{
  "supportUserPermissions": true,
  "supportEnvironments": true,
  "supportWorkspaces": true,
  "supportGtagConfigs": true,
  "supportBuiltInVariables": true,
  "supportClients": true,
  "supportFolders": true,
  "supportTags": true,
  "supportTemplates": true,
  "supportTriggers": true,
  "supportVariables": true,
  "supportVersions": true,
  "supportZones": true,
  "supportTransformations": true
}